{
  "schema_version": "evidence_enrichment_v1",
  "title": "产品迭代与财务对接内部同步",
  "source_type": "meeting_note",
  "source_origin": "内部同步记录",
  "source_occurred_at": "2026-06-10",
  "source_visibility": "private",
  "related_objects": ["product_iteration", "finance_workstream"],
  "language": "zh-CN",
  "admissibility_status": "CAPTURED",
  "review_reasons": []
}
